{
  "schema_version": "phase2-benchmark-1.0",
  "status": "proposed",
  "benchmark_id": "phase2-independent-dataset-relevance",
  "protocol_version": "1.0-proposed",
  "collection_state": "not_started",
  "annotation_state": "not_started",
  "test_label_custody": "not_created",
  "targets": {
    "task_count": 36,
    "tasks_per_modality": {
      "text": 12,
      "tabular": 12,
      "image": 12
    },
    "tasks_per_type": {
      "classification": 14,
      "regression": 8,
      "clustering": 7,
      "detection": 7
    },
    "candidates_per_task": 36,
    "task_candidate_pair_count": 1296,
    "independent_judgments_per_pair": 2,
    "primary_judgment_count": 2592,
    "split_task_counts": {
      "train": 12,
      "development": 6,
      "test": 18
    }
  },
  "seeds": {
    "task_frame_sampling": 20261025,
    "task_split": 20261026,
    "candidate_pool_fill": 20261027,
    "pairwise_ranker": 20261028,
    "cluster_bootstrap": 20261029
  },
  "artifact_hashes": {},
  "tasks": [],
  "candidates": [],
  "task_candidate_pairs": [],
  "annotations": [],
  "provenance_records": [],
  "exclusions": []
}
